{
  "schema_version": "max-1.0",
  "id": "max-posthog-lego",
  "title": "Max the PostHog Hedgehog - LEGO sourcing variant",
  "description": "LEGO sourcing variant with cataloged colors. Smaller bricks and plates replace five difficult Dark Brown part types in the same occupied spaces. Follow the original guide with the substitution sheet. Not physically tested.",
  "author": "Designed with Codex for Adam",
  "license": "UNLICENSED",
  "parts": [
    {
      "id": "p0001",
      "part": "3035",
      "color": "082",
      "x": -6,
      "y": -4,
      "z": 0,
      "rotation": 90
    },
    {
      "id": "p0002",
      "part": "3035",
      "color": "082",
      "x": 2,
      "y": -4,
      "z": 0,
      "rotation": 90
    },
    {
      "id": "p0003",
      "part": "3035",
      "color": "082",
      "x": -2,
      "y": 0,
      "z": 0,
      "rotation": 90
    },
    {
      "id": "p0004-1",
      "part": "3020",
      "color": "082",
      "x": -8,
      "y": 1,
      "z": 0,
      "rotation": 90
    },
    {
      "id": "p0004-2",
      "part": "3020",
      "color": "082",
      "x": -8,
      "y": 5,
      "z": 0,
      "rotation": 90
    },
    {
      "id": "p0005-1",
      "part": "3020",
      "color": "082",
      "x": 6,
      "y": 1,
      "z": 0,
      "rotation": 90
    },
    {
      "id": "p0005-2",
      "part": "3020",
      "color": "082",
      "x": 6,
      "y": 5,
      "z": 0,
      "rotation": 90
    },
    {
      "id": "p0006",
      "part": "3795",
      "color": "082",
      "x": -10,
      "y": 2,
      "z": 0,
      "rotation": 90
    },
    {
      "id": "p0007",
      "part": "3795",
      "color": "082",
      "x": 8,
      "y": 2,
      "z": 0,
      "rotation": 90
    },
    {
      "id": "p0008",
      "part": "3710",
      "color": "082",
      "x": -11,
      "y": 3,
      "z": 0,
      "rotation": 90
    },
    {
      "id": "p0009",
      "part": "3710",
      "color": "082",
      "x": 10,
      "y": 3,
      "z": 0,
      "rotation": 90
    },
    {
      "id": "p0010-1",
      "part": "3020",
      "color": "082",
      "x": -6,
      "y": 4,
      "z": 0,
      "rotation": 0
    },
    {
      "id": "p0010-2",
      "part": "3020",
      "color": "082",
      "x": -6,
      "y": 6,
      "z": 0,
      "rotation": 0
    },
    {
      "id": "p0010-3",
      "part": "3020",
      "color": "082",
      "x": -6,
      "y": 8,
      "z": 0,
      "rotation": 0
    },
    {
      "id": "p0011-1",
      "part": "3020",
      "color": "082",
      "x": 2,
      "y": 4,
      "z": 0,
      "rotation": 0
    },
    {
      "id": "p0011-2",
      "part": "3020",
      "color": "082",
      "x": 2,
      "y": 6,
      "z": 0,
      "rotation": 0
    },
    {
      "id": "p0011-3",
      "part": "3020",
      "color": "082",
      "x": 2,
      "y": 8,
      "z": 0,
      "rotation": 0
    },
    {
      "id": "p0012",
      "part": "3020",
      "color": "082",
      "x": -2,
      "y": 8,
      "z": 0,
      "rotation": 0
    },
    {
      "id": "p0013-1",
      "part": "3020",
      "color": "082",
      "x": -11,
      "y": 4,
      "z": 1,
      "rotation": 0
    },
    {
      "id": "p0013-2",
      "part": "3020",
      "color": "082",
      "x": -7,
      "y": 4,
      "z": 1,
      "rotation": 0
    },
    {
      "id": "p0014-1",
      "part": "3020",
      "color": "082",
      "x": 3,
      "y": 4,
      "z": 1,
      "rotation": 0
    },
    {
      "id": "p0014-2",
      "part": "3020",
      "color": "082",
      "x": 7,
      "y": 4,
      "z": 1,
      "rotation": 0
    },
    {
      "id": "p0015",
      "part": "3035",
      "color": "082",
      "x": -6,
      "y": -4,
      "z": 1,
      "rotation": 90
    },
    {
      "id": "p0016",
      "part": "3035",
      "color": "082",
      "x": 2,
      "y": -4,
      "z": 1,
      "rotation": 90
    },
    {
      "id": "p0017",
      "part": "3035",
      "color": "082",
      "x": -2,
      "y": 0,
      "z": 1,
      "rotation": 90
    },
    {
      "id": "p0018",
      "part": "3021",
      "color": "082",
      "x": -8,
      "y": 1,
      "z": 1,
      "rotation": 90
    },
    {
      "id": "p0019",
      "part": "3021",
      "color": "082",
      "x": 6,
      "y": 1,
      "z": 1,
      "rotation": 90
    },
    {
      "id": "p0020",
      "part": "3022",
      "color": "082",
      "x": -10,
      "y": 2,
      "z": 1,
      "rotation": 90
    },
    {
      "id": "p0021",
      "part": "3022",
      "color": "082",
      "x": 8,
      "y": 2,
      "z": 1,
      "rotation": 90
    },
    {
      "id": "p0022",
      "part": "3024",
      "color": "082",
      "x": -11,
      "y": 3,
      "z": 1,
      "rotation": 90
    },
    {
      "id": "p0023",
      "part": "3024",
      "color": "082",
      "x": 10,
      "y": 3,
      "z": 1,
      "rotation": 90
    },
    {
      "id": "p0024",
      "part": "3666",
      "color": "082",
      "x": -3,
      "y": 4,
      "z": 1,
      "rotation": 90
    },
    {
      "id": "p0025",
      "part": "3666",
      "color": "082",
      "x": 2,
      "y": 4,
      "z": 1,
      "rotation": 90
    },
    {
      "id": "p0026",
      "part": "3666",
      "color": "082",
      "x": -11,
      "y": 6,
      "z": 1,
      "rotation": 0
    },
    {
      "id": "p0027",
      "part": "3020",
      "color": "082",
      "x": -5,
      "y": 6,
      "z": 1,
      "rotation": 90
    },
    {
      "id": "p0028",
      "part": "3795",
      "color": "082",
      "x": 3,
      "y": 6,
      "z": 1,
      "rotation": 0
    },
    {
      "id": "p0029",
      "part": "3023",
      "color": "082",
      "x": 9,
      "y": 6,
      "z": 1,
      "rotation": 90
    },
    {
      "id": "p0030",
      "part": "3024",
      "color": "082",
      "x": 10,
      "y": 6,
      "z": 1,
      "rotation": 90
    },
    {
      "id": "p0031",
      "part": "3710",
      "color": "082",
      "x": -10,
      "y": 7,
      "z": 1,
      "rotation": 0
    },
    {
      "id": "p0032",
      "part": "3623",
      "color": "082",
      "x": -6,
      "y": 7,
      "z": 1,
      "rotation": 90
    },
    {
      "id": "p0033",
      "part": "3023",
      "color": "082",
      "x": -8,
      "y": 8,
      "z": 1,
      "rotation": 0
    },
    {
      "id": "p0034",
      "part": "3020",
      "color": "082",
      "x": -2,
      "y": 8,
      "z": 1,
      "rotation": 0
    },
    {
      "id": "p0035",
      "part": "3021",
      "color": "082",
      "x": 3,
      "y": 8,
      "z": 1,
      "rotation": 0
    },
    {
      "id": "p0036",
      "part": "3023",
      "color": "082",
      "x": 6,
      "y": 8,
      "z": 1,
      "rotation": 0
    },
    {
      "id": "p0037",
      "part": "3020",
      "color": "081",
      "x": -6,
      "y": -4,
      "z": 2,
      "rotation": 0
    },
    {
      "id": "p0038",
      "part": "3020",
      "color": "081",
      "x": 2,
      "y": -4,
      "z": 2,
      "rotation": 0
    },
    {
      "id": "p0039",
      "part": "3020",
      "color": "081",
      "x": -6,
      "y": -2,
      "z": 2,
      "rotation": 0
    },
    {
      "id": "p0040",
      "part": "3020",
      "color": "081",
      "x": 2,
      "y": -2,
      "z": 2,
      "rotation": 0
    },
    {
      "id": "p0041-1",
      "part": "3035",
      "color": "082",
      "x": -6,
      "y": 0,
      "z": 2,
      "rotation": 0
    },
    {
      "id": "p0041-2",
      "part": "3020",
      "color": "082",
      "x": -6,
      "y": 4,
      "z": 2,
      "rotation": 0
    },
    {
      "id": "p0041-3",
      "part": "3020",
      "color": "082",
      "x": -2,
      "y": 4,
      "z": 2,
      "rotation": 0
    },
    {
      "id": "p0042",
      "part": "3035",
      "color": "082",
      "x": 2,
      "y": 0,
      "z": 2,
      "rotation": 90
    },
    {
      "id": "p0043-1",
      "part": "3020",
      "color": "082",
      "x": -8,
      "y": 1,
      "z": 2,
      "rotation": 90
    },
    {
      "id": "p0043-2",
      "part": "3020",
      "color": "082",
      "x": -8,
      "y": 5,
      "z": 2,
      "rotation": 90
    },
    {
      "id": "p0044-1",
      "part": "3020",
      "color": "082",
      "x": 6,
      "y": 1,
      "z": 2,
      "rotation": 90
    },
    {
      "id": "p0044-2",
      "part": "3020",
      "color": "082",
      "x": 6,
      "y": 5,
      "z": 2,
      "rotation": 90
    },
    {
      "id": "p0045",
      "part": "3795",
      "color": "082",
      "x": -10,
      "y": 2,
      "z": 2,
      "rotation": 90
    },
    {
      "id": "p0046",
      "part": "3795",
      "color": "082",
      "x": 8,
      "y": 2,
      "z": 2,
      "rotation": 90
    },
    {
      "id": "p0047",
      "part": "3710",
      "color": "082",
      "x": -11,
      "y": 3,
      "z": 2,
      "rotation": 90
    },
    {
      "id": "p0048",
      "part": "3710",
      "color": "082",
      "x": 10,
      "y": 3,
      "z": 2,
      "rotation": 90
    },
    {
      "id": "p0049",
      "part": "3035",
      "color": "082",
      "x": -6,
      "y": 6,
      "z": 2,
      "rotation": 0
    },
    {
      "id": "p0050",
      "part": "3020",
      "color": "082",
      "x": 2,
      "y": 8,
      "z": 2,
      "rotation": 0
    },
    {
      "id": "p0051",
      "part": "3001",
      "color": "031",
      "x": -6,
      "y": 0,
      "z": 3,
      "rotation": 0
    },
    {
      "id": "p0052",
      "part": "3001",
      "color": "031",
      "x": -2,
      "y": 0,
      "z": 3,
      "rotation": 0
    },
    {
      "id": "p0053",
      "part": "3001",
      "color": "031",
      "x": 2,
      "y": 0,
      "z": 3,
      "rotation": 0
    },
    {
      "id": "p0054",
      "part": "3001",
      "color": "082",
      "x": -8,
      "y": 1,
      "z": 3,
      "rotation": 90
    },
    {
      "id": "p0055",
      "part": "3001",
      "color": "082",
      "x": 6,
      "y": 1,
      "z": 3,
      "rotation": 90
    },
    {
      "id": "p0056",